{
  "schema": "edgp.graph.snapshot.v1",
  "root": "app==1.0.0",
  "ecosystem": "npm",
  "stats": {
    "nodes": 3,
    "edges": 2
  },
  "nodes": [
    {
      "id": "app==1.0.0",
      "name": "app",
      "version": "1.0.0",
      "dependencies": [
        "lib==2.0.0"
      ],
      "dependents": [],
      "metadata": {
        "ecosystem": "npm"
      }
    },
    {
      "id": "lib==2.0.0",
      "name": "lib",
      "version": "2.0.0",
      "dependencies": [
        "core==1.0.0"
      ],
      "dependents": [
        "app==1.0.0"
      ],
      "metadata": {
        "ecosystem": "npm",
        "license": "MIT"
      }
    },
    {
      "id": "core==1.0.0",
      "name": "core",
      "version": "1.0.0",
      "dependencies": [],
      "dependents": [
        "lib==2.0.0"
      ],
      "metadata": {
        "ecosystem": "npm"
      }
    }
  ],
  "edges": [
    {
      "source": "app==1.0.0",
      "target": "lib==2.0.0",
      "relationshipType": 1
    },
    {
      "source": "lib==2.0.0",
      "target": "core==1.0.0",
      "relationshipType": 1
    }
  ],
  "rankings": {
    "mostDependedUpon": [
      {
        "package": "core==1.0.0",
        "dependents": 1
      },
      {
        "package": "lib==2.0.0",
        "dependents": 1
      }
    ]
  }
}
